{
  "schemaVersion": "0.8.0",
  "catalogId": "real-screenshot-fixtures-0.8.0",
  "fixtureCount": 4,
  "distinctness": {
    "allSha256Unique": true,
    "allDimensionsEqual": true,
    "duplicateGroups": []
  },
  "annotationPolicy": {
    "unknownIsValid": true,
    "noMechanicsInferredFromSingleFrame": true,
    "automaticCriticalConfirmation": false
  },
  "fixtures": [
    {
      "fixtureId": "REAL-P7-01",
      "captureSessionId": "user-real-capture-session-2026-06-28",
      "source": {
        "path": "packages/fixtures/real/phase7/round-01.png",
        "originalUploadedName": "1.png",
        "retainedUnmodified": true,
        "width": 2048,
        "height": 1151,
        "format": "PNG",
        "mode": "RGBA",
        "byteSize": 3886066,
        "sha256": "2cbeb481f3f543229f0600e308bdbf5f34fec23c79ca1d1169ed449e2ac57031",
        "provenance": "User-supplied real current-version combat screenshot in project chat on 2026-06-28.",
        "publicDisplayConsent": "not_granted",
        "trainingConsent": "not_granted",
        "possibleUploadScaling": {
          "status": "unknown",
          "isError": false,
          "evidence": "The retained raster is 2048x1151 with no embedded source-resolution metadata. Equal dimensions across all four files do not prove whether an upstream client scaled them."
        }
      },
      "regions": {
        "arena": {
          "x": 180,
          "y": 0,
          "width": 1660,
          "height": 900
        },
        "lowerUi": {
          "x": 0,
          "y": 820,
          "width": 2048,
          "height": 331
        },
        "spellAndActionArea": {
          "x": 520,
          "y": 945,
          "width": 850,
          "height": 206
        },
        "crocoburioTrack": {
          "x": 250,
          "y": 620,
          "width": 730,
          "height": 270
        },
        "dragonTrack": {
          "x": 1050,
          "y": 620,
          "width": 800,
          "height": 270
        }
      },
      "registrationGroundTruth": {
        "referenceToImageAffine": [
          [
            0.7420495657547148,
            -9.697821278088644e-05,
            284.55700107928845
          ],
          [
            9.697821278088644e-05,
            0.7420495657547148,
            13.80732405003328
          ]
        ],
        "method": "offline_sift_annotation_only",
        "inlierCount": 236,
        "medianResidualPx": 0.3786767,
        "p95ResidualPx": 1.2295936,
        "status": "reproducible_reference_annotation"
      },
      "logicalAnnotation": {
        "player": {
          "cell": {
            "x": 1,
            "y": -1
          },
          "status": "visually_verified",
          "confidence": 0.99
        },
        "pillars": [
          {
            "id": "R1P01",
            "cell": {
              "x": -2,
              "y": -7
            },
            "spellType": "indecision",
            "annotationStatus": "visually_verified",
            "confidence": 0.97
          },
          {
            "id": "R1P02",
            "cell": {
              "x": -3,
              "y": -2
            },
            "spellType": "indecision",
            "annotationStatus": "visually_verified",
            "confidence": 0.97
          },
          {
            "id": "R1P03",
            "cell": {
              "x": 1,
              "y": 2
            },
            "spellType": "indecision",
            "annotationStatus": "visually_verified",
            "confidence": 0.97
          },
          {
            "id": "R1P04",
            "cell": {
              "x": 4,
              "y": 1
            },
            "spellType": "indecision",
            "annotationStatus": "visually_verified",
            "confidence": 0.97
          },
          {
            "id": "R1P05",
            "cell": {
              "x": 3,
              "y": 6
            },
            "spellType": "indecision",
            "annotationStatus": "visually_verified",
            "confidence": 0.97
          },
          {
            "id": "R1P06",
            "cell": {
              "x": 11,
              "y": -1
            },
            "spellType": "indecision",
            "annotationStatus": "visually_verified",
            "confidence": 0.97
          },
          {
            "id": "R1P07",
            "cell": {
              "x": -7,
              "y": 2
            },
            "spellType": "reflection",
            "annotationStatus": "visually_verified",
            "confidence": 0.97
          },
          {
            "id": "R1P08",
            "cell": {
              "x": 0,
              "y": -4
            },
            "spellType": "reflection",
            "annotationStatus": "visually_verified",
            "confidence": 0.97
          },
          {
            "id": "R1P09",
            "cell": {
              "x": 2,
              "y": -2
            },
            "spellType": "reflection",
            "annotationStatus": "visually_verified",
            "confidence": 0.97
          },
          {
            "id": "R1P10",
            "cell": {
              "x": -5,
              "y": 6
            },
            "spellType": "reflection",
            "annotationStatus": "visually_verified",
            "confidence": 0.97
          },
          {
            "id": "R1P11",
            "cell": {
              "x": 2,
              "y": 11
            },
            "spellType": "reflection",
            "annotationStatus": "visually_verified",
            "confidence": 0.97
          },
          {
            "id": "R1P12",
            "cell": {
              "x": -3,
              "y": -5
            },
            "spellType": "repulsion",
            "annotationStatus": "visually_verified",
            "confidence": 0.97
          },
          {
            "id": "R1P13",
            "cell": {
              "x": -4,
              "y": 1
            },
            "spellType": "repulsion",
            "annotationStatus": "visually_verified",
            "confidence": 0.97
          },
          {
            "id": "R1P14",
            "cell": {
              "x": 3,
              "y": -5
            },
            "spellType": "repulsion",
            "annotationStatus": "visually_verified",
            "confidence": 0.97
          },
          {
            "id": "R1P15",
            "cell": {
              "x": -3,
              "y": 3
            },
            "spellType": "repulsion",
            "annotationStatus": "visually_verified",
            "confidence": 0.97
          },
          {
            "id": "R1P16",
            "cell": {
              "x": 6,
              "y": -2
            },
            "spellType": "repulsion",
            "annotationStatus": "visually_verified",
            "confidence": 0.97
          },
          {
            "id": "R1P17",
            "cell": {
              "x": 1,
              "y": 5
            },
            "spellType": "repulsion",
            "annotationStatus": "visually_verified",
            "confidence": 0.97
          },
          {
            "id": "R1P18",
            "cell": {
              "x": 8,
              "y": 0
            },
            "spellType": "repulsion",
            "annotationStatus": "visually_verified",
            "confidence": 0.97
          },
          {
            "id": "R1P19",
            "cell": {
              "x": 1,
              "y": 9
            },
            "spellType": "repulsion",
            "annotationStatus": "visually_verified",
            "confidence": 0.97
          },
          {
            "id": "R1P20",
            "cell": {
              "x": -6,
              "y": -2
            },
            "spellType": "attraction",
            "annotationStatus": "visually_verified",
            "confidence": 0.97
          },
          {
            "id": "R1P21",
            "cell": {
              "x": 1,
              "y": -9
            },
            "spellType": "attraction",
            "annotationStatus": "visually_verified",
            "confidence": 0.97
          },
          {
            "id": "R1P22",
            "cell": {
              "x": 2,
              "y": -7
            },
            "spellType": "attraction",
            "annotationStatus": "visually_verified",
            "confidence": 0.97
          },
          {
            "id": "R1P23",
            "cell": {
              "x": 0,
              "y": -1
            },
            "spellType": "attraction",
            "annotationStatus": "visually_verified",
            "confidence": 0.97
          },
          {
            "id": "R1P24",
            "cell": {
              "x": -1,
              "y": 7
            },
            "spellType": "attraction",
            "annotationStatus": "visually_verified",
            "confidence": 0.97
          }
        ],
        "pillarSetCompleteness": "visually_verified_for_visible_arena",
        "glyphPattern": {
          "anchorCell": {
            "x": 0,
            "y": 0
          },
          "confirmedBlackCells": [
            {
              "x": -1,
              "y": -1
            },
            {
              "x": -1,
              "y": 1
            },
            {
              "x": 1,
              "y": 1
            }
          ],
          "confirmedWhiteCells": [
            {
              "x": -3,
              "y": 0
            },
            {
              "x": 0,
              "y": -3
            },
            {
              "x": 0,
              "y": 2
            }
          ],
          "unknownCandidateCells": [
            {
              "x": 3,
              "y": -1
            }
          ],
          "completenessStatus": "provisional_complete",
          "annotationNote": "Only visually clear cells are classified. Occluded or ambiguous cells remain unknown; no mechanic is inferred."
        },
        "resources": {